,idx,word_guesses,first_pass,solution_words,solution
900,900,rive;Siviglia;Chieti;Chio,rive LAR Siviglia C Chieti R Chio NI,Rivelarsi;vigliacchi;e;tirchioni,Rivelarsi vigliacchi e tirchioni
901,901,pari;amare;tic,V I pari ST amare tic O,Vip;aristamaretico,Vip aristamaretico
902,902,col;moccio;lana,col moccio lana,Colm;ozionalà,Colm ozionalà
903,903,asse;soda;oca;oro;mente,asse N soda T oca L oro S A mente,Assenso;dato;calorosamente,Assenso dato calorosamente
904,904,di;ore,E di P ore,Edipo;re,"""Edipo re"""
905,905,orme;vipera,EN orme vipera TO,Enorme;vipera,Enorme vipera
906,906,ala;ara,UN ala C UN ara RA,Una;lacuna;rara,Una lacuna rara
907,907,ottico;orate,B ottico L orate,Botti;colorate,Botti colorate
908,908,lepri;tappeto;cane,lepri M E tappeto S cane,Le;prime;tappe;toscane,Le prime tappe toscane
909,909,Inter;stadi;ferita,Inter V I stadi F ferita,Intervista;differita,Intervista differita
910,910,orari;mine,DI M orari mine SE,Dimora;riminese,Dimora riminese
911,911,orci;la;mi,CO L orci C la mi NO,Color;ciclamino,Color ciclamino
912,912,manesco;fitte,U manesco N fitte,Umane;sconfitte,Umane sconfitte
913,913,dingo;teli,RE dingo teli S A,Redingote;lisa,Redingote lisa
914,914,angelo;orate,FR angelo G orate,Frange;logorate,Frange logorate
915,915,Bacco;ente,PU Bacco GLI ente,Pub;accogliente,Pub accogliente
916,916,stampa;latte,TE stampa latte SA,Testa;p;lattesa,Testa p'latte sa
917,917,rade;anta,LO rade I F anta SMI,L;ora;dei;fantasmi,L'ora dei fantasmi
918,918,ambi;rei;cavolo;gora,C ambi A rei L cavolo gora TO,Cambiare;il;cavo;logorato,Cambiare il cavo logorato
919,919,ara;fari,F ara F fari,Far;affari,Far affari
920,920,pera;tori;pero,DIS pera tori C U pero,Disperato;ricupero,Disperato ricupero
921,921,don;ape;camino,don N ape C camino SA,Donna;peccaminosa,Donna peccaminosa
922,922,ara;piedi;retti,D ara M piedi retti VE,Dar;ampie;direttive,Dar ampie direttive
923,923,di;trattore;viso,di S trattore viso RE,Distratto;revisore,Distratto revisore
924,924,eco;rosone;zio,D eco rosone G O zio,Decoroso;negozio,Decoroso negozio
925,925,ambi;oche;pera;amo,B ambi N oche O pera amo DO,Bambino;che;opera;a;modo,Bambino che opera a modo
926,926,Eros;nato;redini,FI Eros E nato redini ZZA,Fiero;senatore;di;Nizza,Fiero senatore di Nizza
927,927,odi;tait;ali,P odi S tait ali ANO,Podista;italiano,Podista italiano
928,928,cubo;assi;ante,IN cubo assi L L ante,Incubo;assillante,Incubo assillante
929,929,arti;adipe;pero,P arti T adipe pero NI,Partita;di;peperoni,Partita di peperoni
930,930,ago;collage;lati,AR ago STA collage lati N A,Argosta;colla;gelatina,Argosta colla gelatina
931,931,costarica;ape,AC costarica N ape,Accostar;i;canapé,Accostar i canapé
932,932,Arc;redi,F Arc redi T O,Far;credito,Far credito
933,933,Vasco;retta,BRA Vasco LA retta,Brava;scolaretta,Brava scolaretta
934,934,conta;nove;celle,conta DI nove R celle S E,Contadino;vercellese,Contadino vercellese
935,935,fra;telai,fra telai C O,Frate;laico,Frate laico
936,936,staffa;erica,staffa M erica NO,Staff;americano,Staff americano
937,937,nidi;ari;posta,U nidi O T ari S posta,Un;idiota;risposta,Un'idiota risposta
938,938,celle;atomo;laccio,S celle R atomo NEL laccio,Scellerato;monellaccio,Scellerato monellaccio
939,939,avi;tana;Ural,C avi tana T Ural I,Cavità;naturali,Cavità naturali
940,940,prete;ode,prete SAM ode STA,Pretesa;modesta,Pretesa modesta
941,941,musi;capo;polare,musi capo polare,Musica;popolare,Musica popolare
942,942,re;vivi;Gioacchino,B re vivi AG Gioacchino,Brevi;viaggio;a;Cichino,Brevi viaggio a Cichino
943,943,unto;petti,unto U petti NT O,Un;touppet;tinto,Un touppet tinto
944,944,lama;liane,lama G liane R A,La;maglia;nera,La maglia nera
945,945,con;sub;menti,con sub N Z I A menti,Consub;nziamenti,Consub nziamenti
946,946,uncini;raggi,uncini CO raggi RO,Un;cinico;raggiro,Un cinico raggiro
947,947,peri;do;re;ante,peri O do S T re SS ante,Periodo;stressante,Periodo stressante
948,948,rea;mi;Cipro;tetti,T rea mi Cipro tetti V I,Tre;amici;protettivi,Tre amici protettivi
949,949,Cam;isola,Cam P isola TII,Campi;solatii,Campi solatii
950,950,Dante;aro;china,BA Dante M aro C china,Badante;marocchina,Badante marocchina
951,951,Ra;deserto;gale,G Ra N deserto R E gale,Grande;deser;tregale,Grande deser tregale
952,952,Aida;reo,R Aida E reo,Raid;aereo,Raid aereo
953,953,pere;tori;sposi;di;legge,pere N tori E DI sposi ZI O NI di legge,Perentorie;disposizioni;di;legge,Perentorie disposizioni di legge
954,954,fard;star;petti,fard E star S O S petti,Far;destar;sospetti,Far destar sospetti
955,955,pie;Atene,pie TR Atene RA,Pietra;tenera,Pietra tenera
956,956,con;su;toro;oca;coda;ali,con su E toro T oca L coda TTU ali T A,Consueto;rotocalco;d;attualità,Consueto rotocalco d'attualità
957,957,carter;tori,MAR carter RI tori,Marcar;territori,Marcar territori
958,958,rada;ombra,ST rada SG ombra,Strada;sgombra,Strada sgombra
959,959,nave;asce;dente,NO nave R asce N dente,Non;aver;ascendente,Non aver ascendente
960,960,rea;zia;nidi;si,T rea N zia nidi M E S si,Tre;anziani;dismessi,Tre anziani dismessi
961,961,pediatri;iri;ali,C OL pediatri D iri V ali,Colpe;di;tradir;invalidi,Colpe di tradir invalidi
962,962,polla;lori;ratto;nota,polla IO lori T ratto DI G nota,Pollaiolo;Ritratto;d;ignota,"Pollaiolo: ""Ritratto d'ignota"""
963,963,mais;ras;re;alani;are,mais A ras E re N alani M are A,Mai;sarà;serena;l;Anima;Rea,Mai sarà serena l'Anima Rea
964,964,sedia;coli,CA sedia S coli,Case;di;ascoli,Case di ascoli
965,965,stan;chef;rasi;diamanti,stan chef rasi diamanti,Stanche;frasi;di;amanti,Stanche frasi di amanti
966,966,ascia;asola,L ascia T asola,Lasciata;sola,Lasciata sola
967,967,rea;rapa;rosa,C rea TU rapa U rosa,Creatura;paurosa,Creatura paurosa
968,968,Nera;sette,Nera I sette,Nera;Isette,Nera Isette
969,969,olente;rosa;piegata,V olente rosa IM piegata,Volenterosa;impiegata,Volenterosa impiegata
970,970,reo;pantere;amo,P reo C CU pantere CL amo,Preoccupante;reclamo,Preoccupante reclamo
971,971,Anna;Maria,C Anna FU Maria,Canna;fumaria,Canna fumaria
972,972,per;forni,A per forni A NO,Ape;fornianono,Ape fornianono
973,973,gru;piedi;ali,gru P piedi T O R I ali,Gruppi;editoriali,Gruppi editoriali
974,974,gin;are;barba;mento,AR gin are LI M barba RI mento,Arginare;l;imbarbarimento,Arginare l'imbarbarimento
975,975,avi;acido;nata;eco,L avi T acido nata NT eco SE,La;vita;ci;dona;tante;cose,La vita ci dona tante cose
976,976,metro;oli;ami;lane,metro P oli T A N ami lane SE,Metropolitana;milanese,Metropolitana milanese
977,977,ceri;posa,LU ceri posa NTE,Luce;riposante,Luce riposante
978,978,ora;redi;involto,ora T O redi S involto,Oratore;disinvolto,Oratore disinvolto
979,979,fili;stie;rea;latta,fili B U stie rea L latta CCO,Filibustiere;all;attacco,Filibustiere all'attacco
980,980,Tell;ava;la,Tell Y S ava la S,Tellys;Avallas,Tellys Avallas
981,981,Po;rema;china;riva,IM Po RTA rema C china riva RI,Importare;macchinarivi;arsi,Importare macchinarivi arsi
982,982,perni;Tevere;onde,perni E N Tevere C onde,Per;niente;vereconde,Per niente vereconde
983,983,mina;rema;are,ELI mina rema L W are,Eliminare;malware,Eliminare malware
984,984,Ischia;redi;arsi,R Ischia redi SO L arsi,Rischiare;d;isolarsi,Rischiare d'isolarsi
985,985,rive;rete;perla;dio,S C rive rete STI perla R A dio,Scrivere;testi;per;la;radio,Scrivere testi per la radio
986,986,peri;otri;lato,peri O D otri BO lato,Periodo;tribolato,Periodo tribolato
987,987,asso;mento;rio,asso R TI mento VA rio,Assortimento;vario,Assortimento vario
988,988,Atena;Era;azze,SC Atena T Era G azze,Scatenate;ragazze,Scatenate ragazze
989,989,viola;lepri;pio,IN viola BI lepri NCI pio,Inviolabile;principio,Inviolabile principio
990,990,cola;re;naso;mari;ante,VI N cola re U naso M mari L E V ante,Vincolare;una;somma;rilevante,Vincolare una somma rilevante
991,991,ambi;ori;rovo,ambi G U ori T rovo,Ambiguo;ritrovo,Ambiguo ritrovo
992,992,via;santi,A via N santi,Avi;ansianti,Avi ansianti
993,993,su;rema;ile,su O rema DR ile N E,Suore;madrilene,Suore madrilene
994,994,nei;ori;alte;nano;pia;ceri;totem,nei C U ori S I alte R nano I pia ceri E totem RI,Nei;cuori;si;alternano;i;piaceri;e;t;etermi,Nei cuori si alternano i piaceri e t etermi
995,995,etti;divi;Tell,F etti NA divi Tell O,Fettina;di;vitello,Fettina di vitello
996,996,rettili;menti,rettili NE A menti,Retti;lineamenti,Retti lineamenti
997,997,anta;corte;fate;merli;anno,T anta corte S I A fate merli N G anno,Tanta;cortesia;fa;temer;l;inganno,Tanta cortesia fa temer l'inganno
998,998,Nona;bando;rema;lieto;avi,Nona B bando NA rema lieto TT avi A,Non;abbandonare;mal;il;etto;via,Non abbandonare mal il etto via
999,999,orma;Di;astro,F orma Di S astro SA,Forma;disastrosa,Forma disastrosa
1000,1000,lago;costa;esca;api;radura,lago CC IA costa NT esca V AL api ET radura,La;goccia;costante;scava;la;pietra;dura,La goccia costante scava la pietra dura
1001,1001,sedia;capre;su,DA sedia RI capre su NTA,Dase;diarica;presunta,Dase diarica presunta
1002,1002,ari;buche;cereale,C ari buche E M I cereale,Caribù;che;emicereale,Caribù che emicereale
1003,1003,amo;radi;lenti,UN amo ST radi lenti T TE,Una;mostra;di;lentitte,Una mostra di lentitte
1004,1004,rada;teda,ST rada teda NDO,Strada;teddano,Strada teddano
1005,1005,tra;artemisia;Ati,tra T T artemisia L IC Ati,Trattar;temi;sialicati,Trattar temi sialicati
1006,1006,si;tema;dotto,si S tema R I dotto,Sistema;ridotto,Sistema ridotto
1007,1007,parti;tea;pinna;colo,parti tea pinna colo,Partite;a;pinacolo,Partite a pinacolo
1008,1008,atto;divi;aio;nato,PI atto divi TE L aio N nato,Piatto;di;vitelaio;nonnato,Piatto di vitelaio nonnato
1009,1009,bel;linea;coni;ala,bel linea coni N S ala TA,Belliena;con;insalata,Belliena con insalata
1010,1010,su;sardina,su A sardina NNI,Suasardi;nanni,Suasardi nanni
1011,1011,dei;mine,C A dei mine S I,Cadeim;inesimi,Cadeim inesimi
1012,1012,manopola,RI manopola,Rima;novolana,Rima novolana
1013,1013,scafi;ori;colo,DI scafi ori DI colo,Discafi;ordincolo,Discafi ordincolo
1014,1014,armi;anice,armi G anice RMI,Armigani;ce;rmi,Armigani ce rmi
1015,1015,lario;noci,I lario noci R,Ilario;Novicir,Ilario Novicir
1016,1016,cola;re;rame,S E cola re C A rame,Secolare;carame,Secolare carame
1017,1017,legge;aperto,legge R aperto SSE,Leggera;permesso,Leggera permesso
1018,1018,Pieve;ioni,IM Pieve S ioni,Impive;sioni,Impive sioni
1019,1019,nasi;ring;riva;il;lago,U nasi ring A P riva il lago,Una;siringa;priva;gli;alago,Una siringa priva gli 'alago
1020,1020,re;dama;sarda,F re D dama N sarda,Fredda;mansarda,Fredda mansarda
1021,1021,signore;somale,signore I O somale,Signoreioso;male,Signoreioso male
1022,1022,ceri;onda,D I ceri AF onda,Diceria;fonda,Diceria fonda
1023,1023,ria;fetta,MO ria F fetta,Mori;affettata,Mori affettata
1024,1024,re;nani;ettari;dita,re P LI nani ettari B A dita,Replina;niettar;ibadita,Replina niettar ibadita
1025,1025,vento;albero,O vento NC albero,Oven;con;calbe,Oven con calbe
1026,1026,su;dentista;di,su A dentista N di STI,Suadenti;standisti,Suadenti standisti
1027,1027,nata;eredi;rena;alto,U nata P eredi rena ICA alto UR,Una;tapepe;derenai;ca;tour,Una tapepe derenai ca tour
1028,1028,seri;col;medico;serio;nate,CA S seri col medico serio R D I nate,Casse;ricolme;di;cose;riordinate,Casse ricolme di cose riordinate
1029,1029,pesce;atto;otre;tino,pesce atto L otre N tino,Pe;scatozzo;lontinto,Pe scatozzo lontinto
1030,1030,vere;moli,A vere P RE moli,Avere;premioli,Avere premioli
1031,1031,sudan;esili;cieco;gole,sudan esili B I cieco N gole SI,Sudanesi;libici;e;congolesi,Sudanesi libici e congolesi
1032,1032,mici;ara;amaretto,A mici ZI ara FF amaretto,Amicizia;raffamaretto,Amicizia raffamaretto
1033,1033,Shaw;rasi;lista,Shaw U rasi M B O lista,Shawura;simbolista,Shawura simbolista
1034,1034,punti;in;va;la,S punti in NO: va T la,Spunti;innovativa,Spunti innovativa
1035,1035,con;attiva,con T attiva NI,Contatti;vani,Contatti vani
1036,1036,avidi;Ande;tini,N avidi CL Ande S tini,Navi;di;clandestini,Navi di clandestini
1037,1037,dente;aro;edile;nano,STU dente S aro AL edile G nano,Studentesa;roalide;il,Studentesa roalide ilegnano
1038,1038,anta;casa;mina;zia,F anta STI casa mina L I zia,Fantastica;casa;minalizia,Fantastica casa minalizia
1039,1039,oca;nidi;gente,I oca nidi S E R gente,I;ocanidi;se;reggente,I ocanidi se reggente
1040,1040,netta;mori;esca,SCE netta mori C C esca,Scenetta;moricesca,Scenetta moricesca
1041,1041,rio;eco;agli,FU rio eco TT agli A,Furioe;cattaglia,Furioe cattaglia
1042,1042,lima;Esopo;asse;Nino,C lima T Esopo IR asse Nino SI,Clima;teso;poi;irassegninosi,Clima teso poi irassegninosi
1043,1043,lacca;Tampa;redi;ode,lacca DE Tampa LI TA redi M ode NA,L;accedetam;palitare;di;modena,L'accedetam palitare di modena
1044,1044,statua;mele;ali,P E statua R mele G ali,Pestaut;armele;gagli,Pestaut armele gagli
1045,1045,tori;Einaudi,O RA tori Einaudi A NI,Oratori;einaudi,Oratori einaudi
1046,1046,con;ultime;un,I con S ultime un,I;consulti;menu,I consulti menu
1047,1047,peri;come;catino,peri OD I come R catino,Periodico;mercatino,Periodico mercatino
1048,1048,reo;est;oste;carte,AE reo CH est oste C carte R RA,Aereo;che;stop;est;ancora;terra,Aereo che stop est ancora terra
1049,1049,anta;negri;articoli,P anta L O negri articoli A RO,Pantalone;grarit;colario,Pantalone grarit colario
1050,1050,tris;lui e lei;Ti,O tris lui e lei Ti,Otri;sluietiti,Otri sluietiti
1051,1051,campanelli,campanelli TI,Campa;nellì,Campa nellì
1052,1052,nani;cinesi;lare,U nani cinesi NGO lare,Un;anicine;singolare,Un anicine singolare
1053,1053,pali;in;di;ritto,pali N in di S C ritto,Palinindi;scritto,Palinindi scritto
1054,1054,erica;rame;temi;Ra,P erica rame N temi S E Ra,Peri;caramente;misera,Peri caramente misera
1055,1055,caraffa;teso;nidi;ago,CER caraffa teso MP A G nidi SV ago,Cercar;affateso;pignidi;sv;ago,Cercar affateso pignidi sv ago
1056,1056,ali;divo;Ontario;pedali,V ali divo L Ontario S pedali E RI,Validi;volontori;ospedalieri,Validi volontori ospedalieri
1057,1057,raggio;oca;otri;cava;anche,CO raggio S oca P otri cava M anche S,Coraggioso;capo;trica;vamchens,Coraggioso capo trica vamchens
1058,1058,maiali;scia;Di;vite,T O maiali scia Di vite LLO,Tomaia;liscia;di;vitello,Tomaia liscia di vitello
1059,1059,conte;nero;more;anno;are;geni;ori,conte nero A more S anno A M are I geni T ori,Con;tenero;amore;sanno;a;reginitori,Con tenero amore sanno a reginitori
1060,1060,Eracle;Idra,N Eracle SS Idra,Nera;lessidra,Nera lessidra
1061,1061,corto;non;netta,AC corto non netta,Accorto;nonnetta,Accorto nonnetta
1062,1062,ancora;etto;onda,ancora P etto F onda TO,Ancorape;tofdato,Ancorape tofdato
1063,1063,sarde;testa;lima;re,U sarde testa BI lima NI E re,Usar;detestabili;maniere,Usar detestabili maniere
1064,1064,cantone;ante,PO cantone VI G ante,Pocant;onevigante,Pocant onevigante
1065,1065,pelli;scuri;onde;lessi;ossi,CA pelli scuri C onde IR IF lessi R ossi,Capelli;scuri;con;dei;riflessi;rossi,Capelli scuri con dei riflessi rossi
1066,1066,al;asino;lacci,al asino S O lacci,Alas;inosolacci,Alas inosolacci
1067,1067,nani;astri,P A nani R astri,Pananira;striscia,Pananira striscia
1068,1068,seno;ancora;pinta,RO seno N ancora S pinta TE,Rose;non;ancora;spintate,Rose non ancora spintate
1069,1069,ratto;arpa;alone,ratto P P arpa N T alone,Rattoppar;pantalone,Rattoppar pantalone
1070,1070,monili,monili R A,Monil;ira,Monil ira
1071,1071,toro;avi;rosa,S toro T avi GO rosa,Storotavio;groosa,Storotavio groosa
1072,1072,con;auto;viola,con C auto viola FF,Concauto;violà,Concauto violà
1073,1073,arca;odi;idem,M arca T odi V idem,Marcato;dividem,Marcato dividem
1074,1074,asta;federe;are,B asta PO federe DI are,Basta;pofe;dei;rediare,Basta pofe dei rediare
1075,1075,zie;dei;risi,A zie N dei NC risi,Aziende;di;ncrisi,Aziende di ncrisi
1076,1076,lame;tela;amaretto;radio;cere,lame N tela S M amaretto S radio S cere,Lamentela;smamare;tos;radische,Lamentela smamare tos radische
1077,1077,ami;salari;aro;Po;ovoide,ami C O salari P aro LE Po C ovoide,Amico;sa;la;riparo;lepo;voce,Amico sa la riparo lepo voce
1078,1078,traditore;Ino,PRI traditore Ino LE,Pritradito;Reinale,Pritradito Reinale
1079,1079,rovi;amo;mani;radi;rosi,T rovi amo L A mani E radi A rosi,Troviamo;la;maniera;di;arosi,Troviamo la maniera di arosi
1080,1080,tris;romani,VE tris P romani,Vetri;spromani,Vetri spromani
1081,1081,ibis;Enza;arti;ari;stanze;rane,C ibis Enza P arti C OL ari SO stanze rane NTI,Cibi;senza;particolarità;stanzera;ntinti,Cibi senza particolarità stanzera ntinti
1082,1082,in;armadio;in;ozio,in armadio BIL in ozio NI,Inarmadiobilino;zionini,Inarmadiobilino zionini
1083,1083,articoli;asso,FRE articoli asso SO,Freeart;coliasso,Freeart coliasso
1084,1084,sci;eroina,sci OP eroina TTO,Sciopero;in;atto,Sciopero in atto
1085,1085,redi;manico;ali,P redi manico M IN ali,Predimani;comunali,Predimani comunali
1086,1086,pera;Sandro;esca,O pera Sandro C C esca,Opera;sandroclesca,Opera sandroclesca
1087,1087,di;fu;sesto,di F fu sesto RIE,Diffuse;storie,Diffuse storie
1088,1088,scola;risi;Curie;Gene;rosi,scola risi Curie Gene rosi,Scolari;sicuri;e;generosi,Scolari sicuri e generosi
1089,1089,proiettile;serba,proiettile serba,Proietti;serba,Proietti serba
1090,1090,tela;tris;saggi,tela L I tris A E saggi,Telaliti;saesaggi,Telaliti saesaggi
1091,1091,sola;secco;osa;dive,LI sola secco I osa dive RNE,L;isola;seccoiosa;di;Verne,L'isola seccoiosa di Verne
1092,1092,indice;leva,QU indice SI leva,Quindicesile;velocità,Quindicesile velocità
1093,1093,avi;nidi;rame,T avi nidi C A rame,Tavinidi;ca;ramé,Tavinidi ca ramé
1094,1094,edera;ami;are,L edera TT ami L IT are,Le;derattà;militare,Le derattà militare
1095,1095,con;agente;rei;la,con QU I agente rei N C la LI,Conquiage;tener;incalli,Conquiage tener incalli
1096,1096,mattino;mitino;obici;Era,mattino mitino obici Era,Mattinati;monicera,Mattinati monicera
1097,1097,coni;fon;armo;corte;si;arco,coni CA fon I US armo DI corte si P OC arco,Con;i;cafoni;usar;modi;cortesi;poco;carco,Con i cafoni usar modi cortesi poco carco
1098,1098,orsi;Eros,orsi DE Eros SE,Orsiedee;rosse,Orsiedee rosse
1099,1099,picco;lauro;Po,picco lauro Po,Piccola;uropò,Piccola uropò
1100,1100,assi;arco;tini,M assi M arco N tini,Massima;rcontini,Massima rcontini
1101,1101,marcia;lenti,A marcia N SU lenti,Amarc;annessuli,Amarc annessuli
1102,1102,attiva;ali,attiva ND ali C I,Atti;vandalici,Atti vandalici
1103,1103,pesce;bus;tese,pesce bus tese,Pe;scebuste;severe,Pe scebuste severe
1104,1104,mesti;ciocche,D O mesti ciocche V A,Domestici;occhè,Domestici occhè
1105,1105,usa;proiettile,BL usa proiettile,Blusa;proiettile,Blusa proiettile
1106,1106,Boudriot;mante,FU R Boudriot R O mante,Furbo;driotromante,Furbo driotromante
1107,1107,ava;sardine;in,TR ava sardine LV in O,Travasar;din;elvino,Travasar din elvino
1108,1108,elica;tasti;teda;est,D elica tasti F teda L est E,Delicata;stifte;daleste,Delicata stifte daleste
1109,1109,verde;Ford;in;rio,verde F Ford in A rio,Verde;ffordinario,Verde ffordinario
1110,1110,oli;dalie;nani;Tampa,S oli dalie MA G nani Tampa CI,Solidali;e;magnaniti;pacci,Solidali e magnaniti pacci
1111,1111,api;rada;ile,A L api A rada P R ile,Alpa;iarada;p;rile,Alpa iarada p'rile
1112,1112,dragone;medici;olle,SE dragone C medici P olle,Sed;dragon;ce;dicipolle,Sed dragon ce dicipolle
1113,1113,viola;tibia;astri,viola S OT tibia N C astri,Violatos;tibiancastri,Violatos tibiancastri
1114,1114,onde;ultime,W onde RF ultime,Wunderful;time;magia;meravigliosa,Wunderful time (magia meravigliosa)
1115,1115,con;tris;traina;assi,S con tris traina TI assi RO,Scontri;strainati;a;S;Siro,Scontri strainati a S. Siro
1116,1116,nappa;mento;dio;tocca,U nappa RTA mento dio T tocca N Z E,Un;apparamento;di;otto;cance,Un apparamento di otto cance
1117,1117,ave;maniero;vino,ave R E maniero vino SE,Avere;manie;rovinose,Avere manie rovinose
1118,1118,nari;camini;vigneto,U nari C camini E vigneto NIO,Una;ricca;minievi;g;Neto,Una ricca minievi g'Neto
1119,1119,chine;nane;teda,chine F A U nane teda NTO,Chi;ne;fa;una;ne;tè;danto,Chi ne fa una ne tè danto
1120,1120,api;do;roditori;tino,S api do M E roditori S tino,Sapido;mero;distinto,Sapido mero distinto
1121,1121,polo;odi;ossa,A polo G odi ossa P PA,Apologo;di;O;Sappia,Apologo di O. Sappia
1122,1122,maniero;tears,RO maniero V I tears,Romani;e;rovitiese,Romani e rovitiese
1123,1123,vento;Amman;Todi;Lord,E vento Amman T A Todi Lord O,Evento;amman tanto;di;lordò,Evento amman tanto di lordò
1124,1124,voglia;di;si,BI voglia di SUI? si,Bivogliar;di;suisi,Bivogliar di suisi
1125,1125,maniero;severo;si,maniero severo N E si,Manierose;veronesi,Manierose veronesi
1126,1126,uovo;oca;lario,N uovo V oca BO lario,Nuovo;vocabolario,Nuovo vocabolario
1127,1127,pazzo;arpa;alone,S pazzo L arpa N T alone,Spazzolar;pantalone,Spazzolar pantalone
1128,1128,stie;sirena,C O stie sirena I,Costi;eserni,Costi eserni
1129,1129,rane;menta;Rodi;Ra;stan;Scott;cori,rane menta Rodi Ra stan Scott cori,Ran;entramdro;s;Ta;scoccori;a;Toscana,Ran entramdro ira s Ta scoccori a Toscana
1130,1130,conta;monili,conta TTO monili V E,Contatto;monil;ivè,Contatto monil ivè
1131,1131,Volga;est;dente;aro,Volga R est U dente S aro ALE,Volgare;studentesaro;alegale,Volgare studentesaro alegale
1132,1132,bocca;ara,bocca A M ara,Bocca;amara,Bocca amara
1133,1133,leggere,AL leggere ND,Alle;greden,Alle greden
1134,1134,marcia;assise,A marcia MB assise,Amarc;assimissi,Amarc assimissi
1135,1135,ramo;giostra;si,T ramo N giostra S si,Tramongi;ostras,Tramongi ostras
1136,1136,lago;eco;are,CA lago S eco L are,Calagose;colare,Calagose colare
1137,1137,apro;scafi;usci,UN apro scafi usci TA,Una;prosa;fiuscita,Una prosa fiuscita
1138,1138,manica;nana;assi,IM manica nana O CL assi C I,Immani;cananano;classici,Immani cananano classici
1139,1139,lenti;prode,VA lenti prode E R I,Valenti;prodeeri,Valenti prodeeri
1140,1140,est;Pascoli,est RO Pascoli ND,Estropa;scol,Estropa scol
1141,1141,pesce;mostra;pie,pesce D RO mostra pie NO,Pe;sedrombra;stipieno,Pe sedrombra stipieno
1142,1142,aia;pila,G aia BIS pila,Gaia;bispilà,Gaia bispilà
1143,1143,activa;razione,C activa A E razione,Cactiva;aerazione,Cactiva aerazione
1144,1144,toro;mole,OT toro mole ICI,Otto;romole;icici,Otto romole icici
1145,1145,ossi;nari;pista,ossi GE nari P pista NI,Ossigenar;i;pistani,Ossigenar i pistani
1146,1146,cava;Lino;cernie,cava L Lino DI cernie GNA,Cavallino;di;Cernigona,Cavallino di Cernigona
1147,1147,un;quadro;Dell;rizzo,un quadro Dell rizzo,Un;quadro;del;Rizzo,Un quadro del Rizzo
1148,1148,lessi;nari,RI F lessi LU nari,Riflessi;lunari,Riflessi lunari
1149,1149,in;armadio;lepre;Messa,in armadio B I lepre Messa,Inarmadiobile;premessa,Inarmadiobile premessa
1150,1150,Sicilia;ribes;Ero,PO Sicilia U ribes C Ero,Posici;liauerib;escerò,Posici liauerib escerò
1151,1151,anca;rea;la;unta;tosca;ito,M anca rea L la PP unta M EN tosca B IL ito,Mancare;all;appuntamento;scabilito,Mancare all'appuntamento scabilito
1152,1152,re;la;fa,P re GIA la F fa,Pregiola;ffaffa,Pregiola ffaffa
1153,1153,golosi;etti,S O golosi L etti,Sogol;olietti,Sogol olietti
1154,1154,pia;tese;lario;rose,pia N tese C O lario M B rose,Piante;secolari;ombrose,Piante secolari ombrose
1155,1155,attori;acero;asta,PI attori C acero DIP asta,Piatto;ricacer;od;ipasta,Piatto ricacer od ipasta
1156,1156,marce;icona;tris;marce,SA marce icona L tris A marce I,Samarce;ico;naltra;smarcei,Samarce ico naltra smarcei
1157,1157,manopola,GRA manopola,Grande;Napoli,Grande Napoli
1158,1158,ari;posta;chela;ape;lessi,UN ari S posta chela S CI ape RP lessi,Una;risposta;che;lascia;perplessi,Una risposta che lascia perplessi
1159,1159,attori;edera,P I attori C edera,Piatto;ricedera,Piatto ricedera
1160,1160,la;scia;col;mas,la scia col mas TRO,L;ascia;col;mastro,L'ascia col mastro
1161,1161,Parker;scopa;sedile;ante,Parker O RE scopa E sedile V ante,Parkerore;scopo;se;dilevante,Parkerore scopo se dilevante
1162,1162,ellissi;mostra;anonimi;ori;va;ore;ente;ente,B ellissi mostra DI anonimi ori T RO va T ore C ente M ente,Bellissimo;stradianon;imioritro;vorecente,Bellissimo stradianon imioritro vorecente
1163,1163,mantidi;mi,BOM mantidi mi CA,Bomma;timidica,Bomma timidica
1164,1164,polli;dive;Rodi;moli,A M polli N E dive T Rodi moli NO,Ampolline;di;vetro;di;molino,Ampolline di vetro di molino
1165,1165,Pareto;asso,SAM Pareto asso SA,Sampa;retoassosa,Sampa retoassosa
1166,1166,Ro;testa;traditore,P Ro testa CI traditore,Protesta;credito,Protesta credito
1167,1167,ultime;nono,C ultime nono TI,Culti;meno;noti,Culti meno noti
1168,1168,indios;ovalo;terno;ore,indios I T R ovalo terno A M ore,In;Dio;si;trova;l;otterno;amore,In Dio si trova l'otterno amore
1169,1169,Esse;rotti;Tampa;Ci,Esse rotti Tampa Ci,Esser;ottima;piaci,Esser ottima piaci
1170,1170,odi;corti;li,FOT odi corti NA li VE,Foto;di;Cortina;Livè;vera,Foto di Cortina Livè vera
1171,1171,tre;rie;bastioni,V E tre rie DI bastioni NO,Vetrerie;di;bastino,Vetrerie di bastino
1172,1172,allieve;more;su;sullano;avidi,allieve R U more su S sullano I P avidi,Al;lieve;rumore;sussellano;i;pavidi,Al lieve rumore sussellano i pavidi
1173,1173,pero;pero,O pero pero ALE,Operope;perole,Operope perole
1174,1174,forte;nei;Ti;di;dardo,forte nei Ti di dardo,Forte;nei;titidar;do,Forte nei titidar do
1175,1175,trave;sarde;serti;cani,AT trave R sarde serti A FRI cani,Attraversar;deserti;africani,Attraversar deserti africani
1176,1176,con;su;rosi;Bi;di;versi,con su rosi Bi di versi,Consuros;obi;diversi,Consuros obi diversi
1177,1177,Anna;ontano,C Anna C ontano,Cannac;ontano,Cannac ontano
1178,1178,rio;cipresso,B rio cipresso ALE,Brioci;presoale,Brioci presoale
1179,1179,porta;in;data;ondata,porta B L in data S F ondata,Porta;blindata;sondata,Porta blindata sondata
1180,1180,ellissi;leva;calvi,B ellissi leva DI calvi NO,Bellissile;vadical;vi;novano,Bellissile vadical vi novano
1181,1181,cast;rare;reti,cast U rare P A reti,Casturare;pareti,Casturare pareti
1182,1182,rossi;menta,rossi A F menta,Rossia;fentata,Rossia fentata
1183,1183,colli;catena,colli N E catena V E,Colline;catena;veve,Colline catena veve
