,idx,word_guesses,first_pass,solution_words,solution
602,602,presepe;re;tori,IM presepe re N tori E,Imprese;perentorie,Imprese perentorie
603,603,asini;ale,asini N O A P ale,Asinino;a;pale,Asinino a pale
604,604,lenti;adipe;tori,V A lenti adipe S C A tori,Valentia;di;pescatori,Valentia di pescatori
605,605,assi;antere;ali,APP assi ON antere ali TY,Appassionante;realità,Appassionante realità
606,606,Po;Bush;azze,S Po R Bush R azze,Sportùbh;shraddze,Sportùbh shraddze
607,607,tram;ansa;etto,S tram ansa MI CH etto,Straman;samichetto,Straman samichetto
608,608,podista;topi;nato,CA podista topi C C O nato RE,Capo;di;stato;picconatore,Capo di stato picconatore
609,609,pastore;sode,IM pastore sode NSO,Impasto;reso;denso,Impasto reso denso
610,610,bradipi;anta;la,F I bradipi anta R A la,Fibra;di;pianta;rala,Fibra di pianta rala
611,611,stoino;tori;colo,stoino T tori D I colo,Stoinotto;ridicolo,Stoinotto ridicolo
612,612,unto;oli,unto CC oli E VE,Un;tocco;lieve,Un tocco lieve
613,613,duna;rami,RA duna rami CI,Radunar;amici,Radunar amici
614,614,sciame;sola,LI sciame N sola,Liscia;mensola,Liscia mensola
615,615,celle;tesa;ore,E C celle N tesa P ore,Eccellente;sapore,Eccellente sapore
616,616,cono;modista,E cono modista TO,Economo;di;stato,Economo di stato
617,617,tegame;lord,S tegame lord A,Stegam;Eldora,Stegam Eldora
618,618,prete;re;pinte,prete S E re S pinte,Pretese;respinte,Pretese respinte
619,619,barba;ratto,RU barba ratto LI,Rubar;barattoli,Rubar barattoli
620,620,rea;ore;oli,CU rea M ore V oli,Cure;amorevoli,Cure amorevoli
621,621,in;versi;edite;Enza,in versi ON edite ND Enza,Inversioni;ed;identenza,Inversioni ed identenza
622,622,epa;arso;presepe;rami,PR epa R arso R presepe rami CI,Preparar;sorprese;per;amici,Preparar sorprese per amici
623,623,Rodi;Ezechiele;Ra,P Rodi Ezechiele T U Ra,Prodezie;chelètru,Prodezie chelètru
624,624,tra;medi;dito,tra medi T R A dito RI,Trame;di;traditori,Trame di traditori
625,625,stola;gola;Ande,VA stola gola IL Ande SE,Vasto;lago;lailandese,Vasto lago lailandese
626,626,tende;rete;nera;tela;posa,AT tende rete nera M EN tela S posa,Attendere;teneramente;la;sposa,Attendere teneramente la sposa
627,627,con;arpa;re,IN con TR arpa re NTI,Incontrar;parenti,Incontrar parenti
628,628,presa;remo;tigri,presa GI remo MEN tigri GI,Presagire;momenti;grigi,Presagire momenti grigi
629,629,pia;chela;data;ginepro;oca;anni,SAp pia TE chela SBA data G ginepro V oca D anni,Sappiate;che;la;sbadataggine;provoca;danni,Sappiate che la sbadataggine provoca danni
630,630,vita;leva;prete,E vita leva NE prete SE,Evita;le;vane;pretese,Evita le vane pretese!
631,631,primo;remi,primo P remi O,Primo;premio,Primo premio
632,632,in;licei,in FE licei B I,Infelice;ibìo,Infelice ibìo
633,633,ara;faro,C ara F faro TTA,Caraffa;rotta,Caraffa rotta
634,634,frange;re;re;menti,IN frange re I re GO L A menti,Infrangere;i;regolamenti,Infrangere i regolamenti
635,635,favo;sai;presa,favo L O sai M presa,Favolosa;impresa,Favolosa impresa
636,636,est;ancia,R est O M ancia,Resto;mancia,Resto mancia
637,637,ante;Diana,P I ante Diana NAS,Piante;di;ananas,Piante di ananas
638,638,disco;ore;strato,disco R S ore GI strato,Discorso;registrato,Discorso registrato
639,639,alto;coda;lana;sci,D alto NI coda L lana sci T A,Daltonio;calla;nascita,Daltonio calla nascita
640,640,bilia;tori,A bilia T tori,Abili;attori,Abili attori
641,641,alaio;lega;tea;reti,QU alaio E lega N tea reti NO,Qualaioe;legante;aretino,Qualaioe legante aretino
642,642,sol;mesti,sol mesti FA SE,Solm;estifase,Solm estifase
643,643,Adige;nove,ST Adige nove SI,Stadi;genovesi,Stadi genovesi
644,644,avo;avi;cita,F avo S avi N cita,Favosava;vincita,Favosava vincita
645,645,ocarina;Era;peri;collo,D ocarina LIB Era peri L D E collo,Doc;arina;libera;per;il;decollo,Doc arina libera per il decollo
646,646,unta;tram;ciocco,unta tram ciocco,Un;tram;ciocco,Un tram ciocco
647,647,madido;are;mina;teste,PRI madido M IN are DO mina teste SSO,Prima;di;dominare;domina;te;stesso,Prima di dominare domina te stesso
648,648,ara;prese;zio;negra;Cam;ode,UN ara P prese N T A zio negra F I Cam ode R NA,Una;rappresentazione;grafica;moderna,Una rappresentazione grafica moderna
649,649,bacca;teca;asta,bacca R A teca N asta,Baccarate;c;anastà,Baccarate c anastà
650,650,torri;con;torri,torri D A con torri V A,Torrida;conte;rivava,Torrida conte rivava
651,651,sconvolti;lieti,sconvolti G lieti N TE,Scon;volti glie;tinte,Scon volti glie tinte
652,652,rum;iri;secchi,AG rum iri N secchi TI,Agrumi;rinsecchiti,Agrumi rinsecchiti
653,653,cardi;est;dente,cardi N est R I dente,Cardine;stridente,Cardine stridente
654,654,conti;are;unite,conti N U are unite R,Continuare;un;iterator,Continuare un iterator
655,655,ala;chef;ape,M ala TO chef ape NA,Malato;che;fa;pena,Malato che fa pena
656,656,filo;liso;mano,filo liso mano,Filoliso;manovra,Filoliso manovra
657,657,tre;nodi;tori,tre nodi M I N A tori,Treno;di;minatori,Treno di minatori
658,658,gru;Po;ile,gru P Po D ile O NI,Gruppo;di;leoni,Gruppo di leoni
659,659,peri;di;tra;orsi,peri O di tra S C orsi,Periodi;trascorsi,Periodi trascorsi
660,660,pero;nata;in;ante,PE pero nata in C C ante,Peperonata;incante,Peperonata incante
661,661,are;est;ape;ala;rea,F are F est ape R L ala U rea,Fare;festa;per;la;laurea,Fare festa per la laurea
662,662,vittima;est,IN vittima est RI,Invitti;maestri,Invitti maestri
663,663,sposi;odi;ale,DI sposi TIV odi GIT ale,Dispositivo;digitare,Dispositivo digitare
664,664,pie;radice;ami,PE pie radice R ami CA,Peperai;di;ceramica,Peperai di ceramica
665,665,assale;ara,assale R I P ara TO,Assale;riparato,Assale riparato
666,666,armadi;avi;dee;ala;onda,L armadi D avi dee R ala F I onda,L;arma;di;davide;era;la;fionda,L'arma di davide era la fionda
667,667,re;redi;ape;redo;osa,C re DE redi S ape redo GN IC osa,Credere;di;sapere;ogni;cosa,Credere di sapere ogni cosa
668,668,Po;boa,CU Po boa TO,Cupo;boato,Cupo boato
669,669,fiaba;nata,CUF fiaba G nata,Cuffia;bagnata,Cuffia bagnata
670,670,prete;remo;eco;dita,prete ND E remo LT eco M O dita,Pretendere;molte;comodità,Pretendere molte comodità
671,671,ala;crema,L ala crema NO,L;alacre;mano,L'alacre mano
672,672,autostrada;sardi;porta;porta,C autostrada sardi porta I N porta,Cauto;strada;sa;diport;a;importante,Cauto strada sa diport a importante
673,673,radar;mine,radar I mine S E,Rada;riminese,Rada riminese
674,674,tricheco;seta;tine,tricheco NE S seta RA N tine,Trichecone;setrantine,Trichecone setrantine
675,675,manico;toro,manico T toro TTO,Manicotto;rotto,Manicotto rotto
676,676,arabo;lava;elica,P arabo lava N G elica,Parabola;vangelica,Parabola vangelica
677,677,astri;arco;rade,L astri C arco N T rade,Lastricar;contrade,Lastricar contrade
678,678,in;denti;ananas;tasca,in CI denti S ananas S tasca LA,Incidenti;sa;nassa;scalà,Incidenti sa nassa scalà
679,679,nasi;raspe;nata,U nasi G NO raspe TTI nata,Una;signora;spettinata,Una signora spettinata
680,680,avi;ara;avola,L avi T ara PID avola,La;vita;rapida;vola,La vita rapida vola
681,681,asse;lima;canti,T asse L lima N canti,Tasselli;mancanti,Tasselli mancanti
682,682,tine;rio;alte;nati,I tine RA rio alte R nati VO,Itinerario;alternativo,Itinerario alternativo
683,683,gru;oca;rosa;do,gru PP oca N O rosa R do,Gruppo;canoro;sardo,Gruppo canoro sardo
684,684,chino;cono;cono;cera,chino N cono S CE cono S cera,Chi;non;consegna;coscerà,Chi non consegna coscerà
685,685,erta;iris;armi,AV erta NT iris P armi,Aver;tanti;risparmi,Aver tanti risparmi
686,686,aro;are;alata,UN aro S are G alata,Una;rosa;regalata,Una rosa regalata
687,687,massi;Ra,massi LU Ra TI,Mas;silurati,Mas silurati
688,688,attori;star;posa,T R attori star I posa TO,Trattorista;riposato,Trattorista riposato
689,689,neri;rose,P E neri G O rose,Pene;rigorose,Pene rigorose
690,690,tris;est;Adige;tee;cinta,tris T est O RI Adige N tee MI cinta,Triste;storia;di;gente;emicinta,Triste storia di gente emicinta
691,691,ambi;timo;ori;retti,ambi E N timo LT ori ST retti,Ambienti;molto;ristretti,Ambienti molto ristretti
692,692,orto;nidi;ala,P orto nidi P ala ZZI,Portoni;di;palazzi,Portoni di palazzi
693,693,ginepro;onde,PA ginepro F onde,Pagine;profonde,Pagine profonde
694,694,avo;diamante,avo N CE diamante,Avonce;di;amante,Avonce di amante
695,695,lino;pero;soma;lato,lino pero soma lato,L;inoperoso;malato,L'inoperoso malato
696,696,re;re;sol,SP re CA re sol DI,Sprecare;soldi,Sprecare soldi
697,697,auto;tetto;di,"auto tetto di AT, I",Autote;tettonati,Autote tettonati
698,698,titolo;oro,VES titolo G oro,Vestito;logoro,Vestito logoro
699,699,est;arca,P est arca LLI,Pestar;calli,Pestar calli
700,700,corni;Eros,corni C Eros SA,Cornice;rossa,Cornice rossa
701,701,pipa;menti,AM pipa R A menti,Ampi;paramenti,Ampi paramenti
702,702,anta;casa;gradinata,F anta STI casa gradinata LE,Fantastica;casa;di;Gatine,Fantastica casa di Gatine
703,703,rema;redi;vento,T rema redi S P A vento,Tremare;di;spavento,Tremare di spavento
704,704,auto;re,C auto E re,Cauto;eure,Cauto eure
705,705,tende;rea;arco,A T tende rea L V arco,Attendere;al;varco,Attendere al varco
706,706,anta;pollo,S anta pollo NIA,SANT;Apolonia,SANT'Apolonia
707,707,est;Tigri;Giove;oli,V est I Tigri Giove RD OG N oli,Vestiti;grigioverdognoli,Vestiti grigioverdognoli
708,708,assi;ori;orzo,M assi CCI ori NF orzo,Massiccio;rinforzo,Massiccio rinforzo
709,709,nassa;ori;avi;seno;ami,NO nassa P ori L avi TA seno N ami,Non;assapori;la;vita;se;non;ami,Non assapori la vita se non ami
710,710,numero;mano,numero mano,Numo;romano,Numo romano
711,711,arto;cibo;Erato,REP arto cibo R TI Erato,Reparto;cibotierato,Reparto cibotierato
712,712,ras;nato,MIT ras PIA nato,Mitra;spianato,Mitra spianato
713,713,Asti;nidi;rocca,B Asti O nidi rocca TI,Bastioni;idroccati,Bastioni idroccati
714,714,rosi;tassi;est,P rosi tassi LV est RO,Prosità;s;i;lvestro,Prosità s i. lvestro
715,715,teda;ante,teda N Z ante,Tè;danzante,Tè danzante
716,716,ami;iride;tinella;etto,ami C iride N tinella B etto LA,Amici;ridenti;nella;bettola,Amici ridenti nella bettola
717,717,est;pere;avi;tori,F est A pere X avi A tori,Festa;per;ex;aviatori,Festa per ex aviatori
718,718,in;redi;tea;aro,in G redi E N tea M aro,Ingrediente;amaro,Ingrediente amaro
719,719,elfi;Eros;adipe,B elfi OR Eros adipe SCO,Bel;fiore;rosa;di;pesco,Bel fiore rosa di pesco
720,720,rei;re;epe,F A rei LP re S epe,Fare;il;presidente,Fare il presidente
721,721,menti;ari;ari,A U menti T ari FF ari,Aumenti;tariffari,Aumenti tariffari
722,722,Verdi;are,DO Verdi S F are,Dover;disfare,Dover disfare
723,723,sitar;tra;ceste;pale,VI sitar tra ceste C E pale RMO,Visitar;Traceste;capel;Ermomoro,"Visitar Traceste, capel, Ermomoro"
724,724,sci;alberi;dati,sci alberi dati,Scialbe;ridatiti,Scialbe ridatiti
725,725,alci;ridicolo;re,C alci ATO ridicolo re,Calciatori;di;colore,Calciatori di colore
726,726,gogna;topo,A gogna topo STO,Agognato;posto,Agognato posto
727,727,Ero;miss;nari,Ero I CI miss I O nari,Eroici;missionari,Eroici missionari
728,728,re;conta;nati,re NT I conta M I nati,Renti;contaminati,Renti contaminati
729,729,pere;remi;ali;ditali,pere S T remi M ali R I M E ditali,Per;estremi;mali;rimedi;talì,Per estremi mali rimedi talì
730,730,ave;avi,ave R L avi N TA,Averla;vinta,Averla vinta
731,731,Ares;nidi;muli,F Ares OG nidi SAR muli,Fare;sogni;disarmuli,Fare sogni disarmuli
732,732,re;rene;prese;tema;pera;rene;mani,C re DE rene L prese N tema S pera rene L DO mani,Credere;nel;presente;ma;sperare;nel;domani,"Credere nel presente, ma sperare nel domani"
733,733,gerle;assi;diari;tele,LEG gerle M assi ME diari STO tele,Legger;le;massime;di;Aristotele,Legger le massime di Aristotele
734,734,terno;mi;Ero,E terno mi S T Ero,Eterno;mistero,Eterno mistero
735,735,Australia;enti,CL Australia M BI enti,Clabastri;cambienti,Clabastri cambienti
736,736,attico;raggio,P attico raggio SI,Patti;coraggiosi,Patti coraggiosi
737,737,come;nari,"come TI, nari A",Comet;in;aria,Comet in aria
738,738,prime;Marocco;etto,ES prime RSI Marocco L etto,Esprimersi;ma;raccoletto,Esprimersi ma raccoletto
739,739,radio;di;agente,I radio di OS agente,Ira;di;odiosa;gente,Ira di odiosa gente
740,740,polipi;tea;fa;ode;rosi,polipi N tea F fa T T ode C O rosi,Poli;pinte;affatto;decolorosi,Poli pinte affatto decolorosi
741,741,re;tape;osti,P re tape S C osti,Pretapé;scosti,Pretapé scosti
742,742,stie;stie,B E stie R E stie,Bestie;restie,Bestie restie
743,743,peri;redi;etto,S U peri O redi R etto,Superiore;diretto,Superiore diretto
744,744,Siam;ore,A Siam I N ore,Asia;minore,Asia minore
745,745,picche;odi;sci;pera,picche T T odi sci O pera NTI,Picchetto;di;scioperanti,Picchetto di scioperanti
746,746,assi;arse;Ra;re,SC assi N arse R Ra TU re,Scassinar;serrature,Scassinar serrature
747,747,rande;aste;Rodi;ore,G rande MO N aste Rodi S U ore,Grande;monastero;di;Suore,Grande monastero di Suore
748,748,anca;ali;erede;ora,GR anca V ali erede C ora TO,Gran;cavaliere;decorato,Gran cavaliere decorato
749,749,sacco;ala;mi;conca;ore,sacco L G ala mi C O conca L ore,S;accogla;m;icoco;con;calore,S'accogla m'icoco con calore
750,750,Fermat;est,AF Fermat est AR,Afffermate;star,Afffermate star
751,751,con;topo;alato,con topo C OS alato,Conto;poco;salato,Conto poco salato
752,752,Ande;astro;nomi,ST Ande NOG astro nomi CO,Stand;enogastronomico,Stand enogastronomico
753,753,Eva;ore;scale,Eva S ore F I scale,Evasore;fiscale,Evasore fiscale
754,754,arco;nipoti;otre;Dante,ST arco nipoti M otre P I Dante,Star;con;ipoti;trempidante,Star con ipoti trempidante
755,755,conci;toro;greto,conci S toro S E greto,Concistoro;segreto,Concistoro segreto
756,756,ali;coni;ossi,M ali N coni ossi R SO,Malinconiosi;riso,Malinconiosi riso
757,757,denti;gusto;Ati;amati,I denti gusto IZZ Ati amati TA,Identità;uziosità;a;mattà,Identità uziosità a mattà
758,758,capi;dei,capi E N dei C H E,Capiene;definite,Capiene definite
759,759,asso;bacca,SP asso bacca MI,Spassob;accami,Spassob accami
760,760,viole;mani,viole NTI U mani,Violenti;umani,Violenti umani
761,761,nostrano;gente;ed;corso,U nostrano gente L ed I S corso,Uno;strano;g;entelle;discorso,Uno strano g g entelle discorso
762,762,mici;di;lime;cani,mici di A lime C cani S MI,Micidiali;meccanismi,Micidiali meccanismi
763,763,ala;nidi;asino;oro,ES ala ZI O nidi G asino D oro,Esalazioni;di;gas;inodoro,Esalazioni di gas inodoro
764,764,Bambi;note;star;do,Bambi note star do,Bambino;testardo,Bambino testardo
765,765,esca;remo;ore,P esca remo R M ore,Pescare;morire,Pescare morire
766,766,mini;trono,mini S trono TO,Ministro;noto,Ministro noto
767,767,armadio;ginestra,armadio RI ginestra NA,Arma;di;origine;strana,Arma di origine strana
768,768,dive;mani;radici;arsi,dive R S A mani E radici B arsi,Diversa;maniera;di;cibarsi,Diversa maniera di cibarsi
769,769,cella;reo;in,MA cella reo V in I,Macellare;ovini,Macellare ovini
770,770,presepe;fette;tacco,presepe R fette DI tacco NI,Prese;perfette;di;tacconi,Prese perfette di tacconi
771,771,ava;are;are,ava N Z are are T E,Avanzare;a;rete,Avanzare a rete
772,772,asse;otri;strale,asse G N otri ME strale,Assegno;trimestrale,Assegno trimestrale
773,773,Alpi;arditi;ore,P Alpi T arditi M ore,Palpitar;di;timore,Palpitar di timore
774,774,alba;aratri;est,S alba C aratri est E,Salba;c;atrieste,Salba c atrieste
775,775,busto;Roma;tic,AR busto A Roma tic O,Arbusto;aromatico,Arbusto aromatico
776,776,mine;Ron;eco;ave,mine S T Ron eco N F ave,Minestrone;con;fave,Minestrone con fave
777,777,Belgio;torero;mani,Belgio C A torero mani STA,Bel;giocatore;romanista,Bel giocatore romanista
778,778,porta;avido,porta CHI avido RO,Portachiavi;d;oro,Portachiavi d'oro
779,779,orme;colo,EN orme ZOC colo,Enorme;zoccolo,Enorme zoccolo
780,780,anitre;muli;ore,M anitre muli D A M ore,Mani;tremuli;d;amore,Mani tremuli d'amore
781,781,amo;ore;ali,F amo S ore ali T Y,Famoso;realità,Famoso realità
782,782,Edipo;chiave;re,Edipo chiave re,È;di;pochi;avere,È di pochi avere
783,783,odi;si;spider;Ra,C odi si spider Ra TO,Codisi;spid;eratoto,Codisi spid eratoto
784,784,con;tori;ara,con tori N C ara T O,Conto;rincarato,Conto rincarato
785,785,stop;erba;are,PO stop erba L L are,Posto;per;ballare,Posto per ballare
786,786,api;spera;lidi;nato,L api spera BI lidi SE G nato RI,Lapis;per;abili;desegnatori,Lapis per abili desegnatori
787,787,mari;anni,TRA mari NG anni,Tramar;inganni,Tramar inganni
788,788,su;per;tine,su per tine,Superti;neri,Superti neri
789,789,orma;enorme,RIF orma R enorme,Riformare;norme,Riformare norme
790,790,Mantova;seri;iene;isola,STI Mantova S seri Z iene isola I,Stima;novasserize;nei;esolai,Stima novasserize nei esolai
791,791,navi;tosa;ava;ossa,U navi S tosa CR ava TT A R ossa,Una;vistosa;cravatta;rossa,Una vistosa cravatta rossa
792,792,Ate;tra;canti,UN Ate tra canti N A,Una;tetra;cantina,Una tetra cantina
793,793,Ares;cena,F Ares cena TE,Fare;scenate,Fare scenate
794,794,agli;agli;est;menti,T agli agli I NV est I menti,Tagli;agli;investimenti,Tagli agli investimenti
795,795,valle;tese,valle T tese X Y,Vallette;sexy,Vallette sexy
796,796,anta;rei;ali;nome;odi;melone,C anta UT O rei T ali A nome L odi melone N,Cantautore;italiano;melodino;dell;Enne,Cantautore italiano melodino dell Enne
797,797,nano;sa;tele;nove,U nano IO sa tele nove LA,Una;noiosa;telenovela,Una noiosa telenovela
798,798,remi;seno;vela,T remi S seno vela D Y,Tre;miss;e;nove;ladi,Tre miss e nove ladi
799,799,Ate;alette;aria,M Ate RI alette R aria,Materia;letteraria,Materia letteraria
800,800,erba;muta;denti,S erba RIM muta denti M A,Serbar;immutate;dimima,Serbar immutate dimima
801,801,Poe;lino;ali,Poe SI lino C ali CA,Poesì;linocalica,Poesì linocalica
802,802,teste;di;urne,PRO teste di urne,Proteste;diurne,Proteste diurne
803,803,picco;Eva;Eros,picco L Eva SCH Eros A,Piccole;vasche;rosa,Piccole vasche rosa
804,804,colli;netta;chef;rana,colli netta chef rana,Collinetta;che;frana,Collinetta che frana
805,805,sette;distese,sette RIR distese SE,Settè;ridistese,Settè ridistese
806,806,pie;Eva,pie D Eva LGO,Piede;valgo,Piede valgo
807,807,bricco;nero;antico,bricco nero M antico,Briccone;romantico,Briccone romantico
808,808,di;scodella;in,di scodella C in S,Disco;della;Cinq,Disco della Cinq
809,809,re;amo;in;onda,re C L amo in F onda TO,Reclamo;infondato,Reclamo infondato
810,810,tempio;uri,tempio S C uri,Tempi;oscuri,Tempi oscuri
811,811,accetta;eco;si;liuti,accetta R eco N si G liuti LI,Accettare;consigli;utili,Accettare consigli utili
812,812,ante;Adige;va,L AL ante RN Adige NO va,La;lanterna;di;Genova,La lanterna di Genova
813,813,vetri;tine,N O vetri E S tine,Nove;triestine,Nove triestine
814,814,Alpi;tea;tesa,P Alpi TAN tea T tesa,Palpitante;attesa,Palpitante attesa
815,815,romani;ape;etto,GI romani C ape RF etto,Giromanica;perfetto,Giromanica perfetto
816,816,rasi;nate;remi,G rasi nate G remi T E,Grasinate;gremite,Grasinate gremite
817,817,tesa;Ionio;rose,MOL tesa NZ Ionio N E rose,Molte;sanzioni;onerose,Molte sanzioni onerose
818,818,oli;noci;antenne,T OP oli noci N Q U antenne,Topolino;cinquantenne,Topolino cinquantenne
819,819,Tag;diva;rime,S Tag E diva rime SI,Stadi;di;vari;mesi,Stadi di vari mesi
820,820,radici;aste;agli,F radici aste R P agli A,Fradicia;sterpaglia,Fradicia sterpaglia
821,821,avo;ora;nato,L avo R ora FFI nato,Lavoro;raffinato,Lavoro raffinato
822,822,ali;erta,L ali B erta,La;libertà,La libertà
823,823,Allen;are;eredi,Allen T are L eredi N I,Allentare;le;redini,Allentare le redini
824,824,are;etto,F are FF etto,Far;effetto,Far effetto
825,825,pieno;tede;lati,COP pieno tede L lati VU,Coppie;note;della;tivù,Coppie note della tivù
826,826,est;remo;rigo;re,est remo rigo re,Estremo;rigore,Estremo rigore
827,827,ala;coni;chiostro,C ala M A I coni N chiostro,Calamai;con;inchiostro,Calamai con inchiostro
828,828,tra;man;uova,tra man uova,Trama;nuova,Trama nuova
829,829,neve;ali,PIN neve N TR ali,Pinne;ventrali,Pinne ventrali
830,830,si;cachet;menta,MU si cachet O R menta,Musica;che;tormenta,Musica che tormenta
831,831,oli;mente;angoli;oca;tori;tacco,S oli TA mente F angoli GI oca tori D A T tacco,Solitamente;fan;gli;o;giocatori;d;attacco,Solitamente fan gli o giocatori d'attacco
832,832,menti;pia;oli,M O menti pia CE V oli,Momenti;piacevoli,Momenti piacevoli
833,833,osso;lana;mici,GR osso lana CO mici TA,Grosolana;comicità,Grosolana comicità
834,834,con;danza;intere,con COR danza D intere SSI,Concordanza;d;interessi,Concordanza d'interessi
835,835,ave;avo;cero,ave R L avo cero CA,Aver;la;voce;roca,Aver la voce roca
836,836,raggio;oli;tic,CO raggio SAP oli tic A,Coraggiosa;politica,Coraggiosa politica
837,837,in;ile;orzo,in U T ile SF orzo,Inutile;sforzo,Inutile sforzo
838,838,rivo;epa;rose,rivo L T epa U rose,Rivolte;paurose,Rivolte paurose
839,839,sporta;remo;tori,E sporta remo L tori S O,Esportare;molto;riso,Esportare molto riso
840,840,pira;remo;tasti,IS pira remo L tasti MA,Ispirare;molta;stima,Ispirare molta stima
841,841,ambi;tee;re;dita,ambi tee re dita,Ambite;eredità,Ambite eredità
842,842,setter;lettori,setter I F lettori,Sette;riflettori,Sette riflettori
843,843,cunicolo;si,AL cunicolo S si,Alcuni;colossi,Alcuni colossi
844,844,va;va;espressi,E va SI va espressi ON E,Evasiva;espressione,Evasiva espressione
845,845,semi;seri,FAL semi seri E,False;miserie,False miserie
846,846,ali;nasi;liana,S ali nasi C I liana,Salina;siciliana,Salina siciliana
847,847,Po;rete;poli,Po VE rete N D O poli,Povere;tendopoli,Povere tendopoli
848,848,ritto;reni;lista,SC ritto reni CH I lista,Scrittore;nichilista,Scrittore nichilista
849,849,pia;rete;reni,S pia NA rete R reni,Spianare;terreni,Spianare terreni
850,850,lama;oca;oca;oca,lama T oca L CI oca RI oca,L;amato;calcio;carioca,L'amato calcio carioca
851,851,in;lire;ami,in U T I lire C L ami,Inutili;reclami,Inutili reclami
852,852,serra;ante,LA serra D I ante,Laser;radiante,Laser radiante
853,853,paperi;alata,RA paperi NS alata,Rapa;per;insalata,Rapa per insalata
854,854,pia;re;con;divi,pia C E re con divi SO,Piacere;condiviso,Piacere condiviso
855,855,rive;rive;chiavi,rive D E rive C chiavi,Riveder;i;vecchi;avi,Riveder i vecchi avi
856,856,menta;ore;pero,MO menta NE ore CU pero,Momentaneo;recupero,Momentaneo recupero
857,857,con;ori;atto,con T ori F atto,Conto;rifatto,Conto rifatto
858,858,tre;maghi;otto;neri,E S tre maghi otto neri A,Estrema;ghignoteria,Estrema ghignoteria
859,859,Curie;Sem,OS Curie Sem PI,Oscuri;esempi,Oscuri esempi
860,860,mahout;ossa,mahout OL ossa L I,Mahou;tologolali,Mahou tologolali
861,861,rada;stiva;pera;vere;etto,TA rada S stiva RE pera vere I L N etto,Tara;da;stivare;per;avere;il;netto,Tara da stivare per avere il netto
862,862,ara;dio;Era,UN ara dio LI B Era,Una;radio;libera,Una radio libera
863,863,bacca;olivi,bacca L olivi D O,Baccalo;livido,Baccalo livido
864,864,macaco;re;eco;orata,A macaco N re T eco L orata,Amaca;con;rete;colorata,Amaca con rete colorata
865,865,melo;di;amo;sedile;ha,melo di EF amo sedile ha R,Melodie;famose;di;Lehar,Melodie famose di Lehar
866,866,irato;reo;timo,T irato reo T timo,Tiratore;ottimo,Tiratore ottimo
867,867,orata;cagna,M orata C cagna,Morà;taccagna,Morà taccagna
868,868,rime;rime;orti,OPP rime rime N O F orti,Opprimer;i;meno;forti,Opprimer i meno forti
869,869,ma;che;fa;Cile,ma che fa Cile,Machef;acilè,Machef acilè
870,870,sante;irosa,CRI sante M irosa,Crisantemi;rosa,Crisantemi rosa
871,871,Po;sorci;si,S Po N sorci NE si,Sponsor;cinesi,Sponsor cinesi
872,872,seme;isba;lime,seme DIT isba G lime N O,Se;mediti;sbagli;meno,Se mediti sbagli meno
873,873,setter;oste;ali;peri;orso;remi,setter ISP oste V ali D E peri L CO NC orso A P remi,Sette;risposte;valide;per;il;concorso;a;premi,Sette risposte valide per il concorso a premi
874,874,porta;tiretti;fiche;porta,IM porta N tiretti fiche AP porta TE,Importanti;rettifiche;apportate,Importanti rettifiche apportate
875,875,cemento;olio;oli,CUO cemento ST olio MAI oli,Cuoce;con;testoli;o;maioili,Cuoce con testoli o maioili
876,876,regge;palla;di,regge palla di AN E,Regge;palladiane,Regge palladiane
877,877,pesco;volto,PO pesco N volto,Popo;scenvolto,Popo scenvolto
878,878,teso;erta,AR teso FF erta,Arte;sofferta,Arte sofferta
879,879,rovi;sole;tane,P rovi N sole N tane,Provinsol;entane,Provinsol entane
880,880,versi;nido;rette,versi O nido P E rette,Versioni;d;operette,Versioni d'operette
881,881,medi;Cile,E SA medi FFI Cile,Esame;difficile,Esame difficile
882,882,Egitto;micio;Ande,OSP Egitto micio L Ande SI,Ospeggi;timici;olandesi,Ospeggi timici olandesi
883,883,listino;dame;cani,SO listino R dame R I cani,Solisti;nordamericani,Solisti nordamericani
884,884,Coppi;menti;ori;ali,A C Coppi A menti ori G I N ali,Accoppiamenti;originali,Accoppiamenti originali
885,885,lista;epa;sale,lista NT epa S sale STO,L;istante;passa;lesto,L'istante passa lesto
886,886,Matera;saio;pero,Matera S saio O pero SO,Materassai;operoso,Materassai operoso
887,887,zia;tir;polli,VI zia tir A M polli,Viziati;rampolli,Viziati rampolli
888,888,ape;nane;osa,UN ape RSO nane RV osa,Una;persona;nervosa,Una persona nervosa
889,889,sta;per;dare,sta M per A dare,Stampe;rara;rede,Stampe rara rede
890,890,porta;icone;re;maga;ante,COM porta RS icone ST re maga L ante RIA,Comportarsi;con;estrema;galanteria,Comportarsi con estrema galanteria
891,891,melo;tane,OR melo N tane,Orme;lontane,Orme lontane
892,892,eredi;mani;ala,E SS eredi mani C ala RGA,Essere;di;manica;larga,Essere di manica larga
893,893,re;para;dama;giare,P re para R E dama N giare,Preparare;da;mangiare,Preparare da mangiare
894,894,la;note;nodi;gente,la L UN note nodi L I gente,L;alunno;teno;diligente,L'alunno teno diligente
895,895,tra;noci;noce,S tra noci C A noce,Strano;cicanoce,Strano cicanoce
896,896,union;ape;oli;Era,S union T ape T R oli F Era,Suunità;petrolifera,Suunità petrolifera
897,897,serti;altruisti;lenti,ES serti altruisti ND O lenti,Esser;tali;truistini,Esser tali truistini
898,898,ari;posta;auto;aria,U N ari S posta auto RI T aria,Una;risposta;autoritaria,Una risposta autoritaria
899,899,serve;re;con,ES serve re con DI,Esser;verecondi,Esser verecondi
